{
  "$schema": "http://json-schema.org/draft-04/schema#",
  "id": "toxicity_event",
  "title": "Toxicity Event",
  "type": "object",
  "namespace": "urn:nmmi:lu177-psma:model",
  "category": "clinical",
  "program": "*",
  "project": "*",
  "description": "Individual adverse-event assessment with CTCAE version, term, grade and attribution.",
  "additionalProperties": false,
  "submittable": true,
  "validators": null,
  "links": [
    {
      "name": "therapy_courses",
      "backref": "nmmi_toxicity_event_therapy_courses",
      "label": "related_to",
      "target_type": "therapy_course",
      "multiplicity": "many_to_one",
      "required": true
    },
    {
      "name": "therapy_cycles",
      "backref": "nmmi_toxicity_event_therapy_cycles",
      "label": "related_to",
      "target_type": "therapy_cycle",
      "multiplicity": "many_to_many",
      "required": false
    },
    {
      "name": "absorbed_doses",
      "backref": "nmmi_toxicity_event_absorbed_doses",
      "label": "supported_by",
      "target_type": "absorbed_dose",
      "multiplicity": "many_to_many",
      "required": false
    },
    {
      "name": "timepoints",
      "backref": "nmmi_toxicity_event_timepoints",
      "label": "related_to",
      "target_type": "timepoint",
      "multiplicity": "many_to_one",
      "required": false
    },
    {
      "name": "provenance_records",
      "backref": "nmmi_toxicity_event_provenance_records",
      "label": "documented_by",
      "target_type": "provenance",
      "multiplicity": "many_to_many",
      "required": false
    },
    {
      "name": "laboratory_measurements",
      "target_type": "measurement",
      "backref": "nmmi_toxicity_event_laboratory_measurements",
      "label": "related_to",
      "multiplicity": "many_to_many",
      "required": false
    }
  ],
  "required": [
    "type",
    "submitter_id",
    "therapy_courses",
    "ctcae_version",
    "ctcae_term",
    "grade"
  ],
  "uniqueKeys": [
    [
      "id"
    ],
    [
      "project_id",
      "submitter_id"
    ]
  ],
  "systemProperties": [
    "id",
    "project_id",
    "state",
    "created_datetime",
    "updated_datetime"
  ],
  "properties": {
    "type": {
      "enum": [
        "toxicity_event"
      ]
    },
    "submitter_id": {
      "type": "string",
      "description": "Stable submitter-assigned identifier, unique within a project. Do not encode direct patient identifiers.",
      "minLength": 1
    },
    "id": {
      "pattern": "^[a-fA-F0-9]{8}-[a-fA-F0-9]{4}-[a-fA-F0-9]{4}-[a-fA-F0-9]{4}-[a-fA-F0-9]{12}$",
      "systemAlias": "node_id",
      "term": {
        "description": "A 128-bit identifier. Depending on the mechanism used to generate it, it is either guaranteed to be different from all other UUIDs/GUIDs generated until 3400 AD or extremely likely to be different. Its relatively small size lends itself well to sorting, ordering, and hashing of all sorts, storing in databases, simple allocation, and ease of programming in general.\n",
        "termDef": {
          "cde_id": "C54100",
          "cde_version": null,
          "source": "NCIt",
          "term": "Universally Unique Identifier",
          "term_url": "https://ncit.nci.nih.gov/ncitbrowser/ConceptReport.jsp?dictionary=NCI_Thesaurus&version=16.02d&ns=NCI_Thesaurus&code=C54100"
        }
      },
      "type": "string"
    },
    "project_id": {
      "term": {
        "description": "Unique ID for any specific defined piece of work that is undertaken or attempted to meet a single requirement.\n"
      },
      "type": "string"
    },
    "state": {
      "default": "validated",
      "downloadable": [
        "uploaded",
        "md5summed",
        "validating",
        "validated",
        "error",
        "invalid",
        "released"
      ],
      "oneOf": [
        {
          "enum": [
            "uploading",
            "uploaded",
            "md5summing",
            "md5summed",
            "validating",
            "error",
            "invalid",
            "suppressed",
            "redacted",
            "live"
          ]
        },
        {
          "enum": [
            "validated",
            "submitted",
            "released"
          ]
        }
      ],
      "public": [
        "live"
      ],
      "term": {
        "description": "The current state of the object.\n"
      }
    },
    "created_datetime": {
      "oneOf": [
        {
          "format": "date-time",
          "type": "string"
        },
        {
          "type": "null"
        }
      ],
      "term": {
        "description": "A combination of date and time of day in the form [-]CCYY-MM-DDThh:mm:ss[Z|(+|-)hh:mm]\n"
      }
    },
    "updated_datetime": {
      "oneOf": [
        {
          "format": "date-time",
          "type": "string"
        },
        {
          "type": "null"
        }
      ],
      "term": {
        "description": "A combination of date and time of day in the form [-]CCYY-MM-DDThh:mm:ss[Z|(+|-)hh:mm]\n"
      }
    },
    "therapy_courses": {
      "type": "array",
      "items": {
        "type": "object",
        "additionalProperties": false,
        "properties": {
          "submitter_id": {
            "type": "string",
            "minLength": 1
          },
          "id": {
            "pattern": "^[a-fA-F0-9]{8}-[a-fA-F0-9]{4}-[a-fA-F0-9]{4}-[a-fA-F0-9]{4}-[a-fA-F0-9]{12}$",
            "term": {
              "description": "A 128-bit identifier. Depending on the mechanism used to generate it, it is either guaranteed to be different from all other UUIDs/GUIDs generated until 3400 AD or extremely likely to be different. Its relatively small size lends itself well to sorting, ordering, and hashing of all sorts, storing in databases, simple allocation, and ease of programming in general.\n",
              "termDef": {
                "cde_id": "C54100",
                "cde_version": null,
                "source": "NCIt",
                "term": "Universally Unique Identifier",
                "term_url": "https://ncit.nci.nih.gov/ncitbrowser/ConceptReport.jsp?dictionary=NCI_Thesaurus&version=16.02d&ns=NCI_Thesaurus&code=C54100"
              }
            },
            "type": "string"
          }
        },
        "oneOf": [
          {
            "required": [
              "submitter_id"
            ]
          },
          {
            "required": [
              "id"
            ]
          }
        ]
      },
      "uniqueItems": true,
      "description": "Link to therapy_course records by submitter_id or UUID.",
      "minItems": 1,
      "maxItems": 1
    },
    "therapy_cycles": {
      "type": "array",
      "items": {
        "type": "object",
        "additionalProperties": false,
        "properties": {
          "submitter_id": {
            "type": "string",
            "minLength": 1
          },
          "id": {
            "pattern": "^[a-fA-F0-9]{8}-[a-fA-F0-9]{4}-[a-fA-F0-9]{4}-[a-fA-F0-9]{4}-[a-fA-F0-9]{12}$",
            "term": {
              "description": "A 128-bit identifier. Depending on the mechanism used to generate it, it is either guaranteed to be different from all other UUIDs/GUIDs generated until 3400 AD or extremely likely to be different. Its relatively small size lends itself well to sorting, ordering, and hashing of all sorts, storing in databases, simple allocation, and ease of programming in general.\n",
              "termDef": {
                "cde_id": "C54100",
                "cde_version": null,
                "source": "NCIt",
                "term": "Universally Unique Identifier",
                "term_url": "https://ncit.nci.nih.gov/ncitbrowser/ConceptReport.jsp?dictionary=NCI_Thesaurus&version=16.02d&ns=NCI_Thesaurus&code=C54100"
              }
            },
            "type": "string"
          }
        },
        "oneOf": [
          {
            "required": [
              "submitter_id"
            ]
          },
          {
            "required": [
              "id"
            ]
          }
        ]
      },
      "uniqueItems": true,
      "description": "Link to therapy_cycle records by submitter_id or UUID."
    },
    "absorbed_doses": {
      "type": "array",
      "items": {
        "type": "object",
        "additionalProperties": false,
        "properties": {
          "submitter_id": {
            "type": "string",
            "minLength": 1
          },
          "id": {
            "pattern": "^[a-fA-F0-9]{8}-[a-fA-F0-9]{4}-[a-fA-F0-9]{4}-[a-fA-F0-9]{4}-[a-fA-F0-9]{12}$",
            "term": {
              "description": "A 128-bit identifier. Depending on the mechanism used to generate it, it is either guaranteed to be different from all other UUIDs/GUIDs generated until 3400 AD or extremely likely to be different. Its relatively small size lends itself well to sorting, ordering, and hashing of all sorts, storing in databases, simple allocation, and ease of programming in general.\n",
              "termDef": {
                "cde_id": "C54100",
                "cde_version": null,
                "source": "NCIt",
                "term": "Universally Unique Identifier",
                "term_url": "https://ncit.nci.nih.gov/ncitbrowser/ConceptReport.jsp?dictionary=NCI_Thesaurus&version=16.02d&ns=NCI_Thesaurus&code=C54100"
              }
            },
            "type": "string"
          }
        },
        "oneOf": [
          {
            "required": [
              "submitter_id"
            ]
          },
          {
            "required": [
              "id"
            ]
          }
        ]
      },
      "uniqueItems": true,
      "description": "Link to absorbed_dose records by submitter_id or UUID."
    },
    "timepoints": {
      "type": "array",
      "items": {
        "type": "object",
        "additionalProperties": false,
        "properties": {
          "submitter_id": {
            "type": "string",
            "minLength": 1
          },
          "id": {
            "pattern": "^[a-fA-F0-9]{8}-[a-fA-F0-9]{4}-[a-fA-F0-9]{4}-[a-fA-F0-9]{4}-[a-fA-F0-9]{12}$",
            "term": {
              "description": "A 128-bit identifier. Depending on the mechanism used to generate it, it is either guaranteed to be different from all other UUIDs/GUIDs generated until 3400 AD or extremely likely to be different. Its relatively small size lends itself well to sorting, ordering, and hashing of all sorts, storing in databases, simple allocation, and ease of programming in general.\n",
              "termDef": {
                "cde_id": "C54100",
                "cde_version": null,
                "source": "NCIt",
                "term": "Universally Unique Identifier",
                "term_url": "https://ncit.nci.nih.gov/ncitbrowser/ConceptReport.jsp?dictionary=NCI_Thesaurus&version=16.02d&ns=NCI_Thesaurus&code=C54100"
              }
            },
            "type": "string"
          }
        },
        "oneOf": [
          {
            "required": [
              "submitter_id"
            ]
          },
          {
            "required": [
              "id"
            ]
          }
        ]
      },
      "uniqueItems": true,
      "description": "Link to timepoint records by submitter_id or UUID.",
      "maxItems": 1
    },
    "provenance_records": {
      "type": "array",
      "items": {
        "type": "object",
        "additionalProperties": false,
        "properties": {
          "submitter_id": {
            "type": "string",
            "minLength": 1
          },
          "id": {
            "pattern": "^[a-fA-F0-9]{8}-[a-fA-F0-9]{4}-[a-fA-F0-9]{4}-[a-fA-F0-9]{4}-[a-fA-F0-9]{12}$",
            "term": {
              "description": "A 128-bit identifier. Depending on the mechanism used to generate it, it is either guaranteed to be different from all other UUIDs/GUIDs generated until 3400 AD or extremely likely to be different. Its relatively small size lends itself well to sorting, ordering, and hashing of all sorts, storing in databases, simple allocation, and ease of programming in general.\n",
              "termDef": {
                "cde_id": "C54100",
                "cde_version": null,
                "source": "NCIt",
                "term": "Universally Unique Identifier",
                "term_url": "https://ncit.nci.nih.gov/ncitbrowser/ConceptReport.jsp?dictionary=NCI_Thesaurus&version=16.02d&ns=NCI_Thesaurus&code=C54100"
              }
            },
            "type": "string"
          }
        },
        "oneOf": [
          {
            "required": [
              "submitter_id"
            ]
          },
          {
            "required": [
              "id"
            ]
          }
        ]
      },
      "uniqueItems": true,
      "description": "Link to provenance records by submitter_id or UUID."
    },
    "model_version": {
      "type": "string",
      "description": "Version of the submitting theranostics extension, independently of the MIDRC baseline version."
    },
    "record_status": {
      "type": "string",
      "description": "Record curation state, independent of clinical value.",
      "enum": [
        "draft",
        "reviewed",
        "approved",
        "superseded",
        "withdrawn"
      ]
    },
    "source_record_id": {
      "type": "string",
      "description": "Identifier of the originating source record; use an approved pseudonym when needed."
    },
    "source_system": {
      "type": "string",
      "description": "Source system or data provider."
    },
    "missing_properties": {
      "type": "array",
      "description": "Names of properties missing from this record; no missing value is encoded as zero.",
      "items": {
        "type": "string"
      }
    },
    "missing_reasons": {
      "type": "array",
      "description": "Reasons corresponding by index to missing_properties.",
      "items": {
        "enum": [
          "unknown",
          "not_collected",
          "not_applicable",
          "not_available",
          "withheld",
          "pending"
        ]
      }
    },
    "assessment_datetime": {
      "type": "string",
      "description": "ISO 8601 assessment datetime; use approved date shifting consistently within the case.",
      "format": "date-time"
    },
    "days_from_course_start": {
      "type": "number",
      "description": "Signed elapsed days from the linked therapy course start."
    },
    "time_basis": {
      "type": "string",
      "description": "Interpretation of stored dates and elapsed times.",
      "enum": [
        "actual",
        "shifted",
        "relative_only",
        "unknown"
      ]
    },
    "time_window_start_day": {
      "type": "number",
      "description": "Beginning of assessment window relative to course start, in days."
    },
    "time_window_end_day": {
      "type": "number",
      "description": "End of assessment window relative to course start, in days."
    },
    "ctcae_version": {
      "type": "string",
      "description": "Versioned adverse event ctcae version."
    },
    "ctcae_term": {
      "type": "string",
      "description": "Versioned adverse event ctcae term."
    },
    "ctcae_code": {
      "type": "string",
      "description": "Versioned adverse event ctcae code."
    },
    "grade": {
      "type": "integer",
      "description": "Observed CTCAE grade. Term-specific allowed grades require external versioned CTCAE validation.",
      "minimum": 1,
      "maximum": 5
    },
    "serious": {
      "type": "boolean",
      "description": "Seriousness is a separate concept from CTCAE severity."
    },
    "onset_date": {
      "type": "string",
      "description": "Date of onset date.",
      "format": "date"
    },
    "resolution_date": {
      "type": "string",
      "description": "Date of resolution date.",
      "format": "date"
    },
    "ae_attribution_to_lu177": {
      "type": "string",
      "description": "Assessment of whether the AE is related to Lu-177 PSMA therapy."
    },
    "ae_related_cycle_number": {
      "type": "integer",
      "description": "Specifies the Lu-177 PSMA treatment cycle number most closely associated with the onset or assessment of the AE."
    },
    "laboratory_measurements": {
      "anyOf": [
        {
          "type": "object",
          "additionalProperties": false,
          "properties": {
            "submitter_id": {
              "type": "string",
              "minLength": 1
            },
            "id": {
              "pattern": "^[a-fA-F0-9]{8}-[a-fA-F0-9]{4}-[a-fA-F0-9]{4}-[a-fA-F0-9]{4}-[a-fA-F0-9]{12}$",
              "term": {
                "description": "A 128-bit identifier. Depending on the mechanism used to generate it, it is either guaranteed to be different from all other UUIDs/GUIDs generated until 3400 AD or extremely likely to be different. Its relatively small size lends itself well to sorting, ordering, and hashing of all sorts, storing in databases, simple allocation, and ease of programming in general.\n",
                "termDef": {
                  "cde_id": "C54100",
                  "cde_version": null,
                  "source": "NCIt",
                  "term": "Universally Unique Identifier",
                  "term_url": "https://ncit.nci.nih.gov/ncitbrowser/ConceptReport.jsp?dictionary=NCI_Thesaurus&version=16.02d&ns=NCI_Thesaurus&code=C54100"
                }
              },
              "type": "string"
            }
          },
          "anyOf": [
            {
              "required": [
                "submitter_id"
              ]
            },
            {
              "required": [
                "id"
              ]
            }
          ]
        },
        {
          "type": "array",
          "items": {
            "type": "object",
            "additionalProperties": false,
            "properties": {
              "submitter_id": {
                "type": "string",
                "minLength": 1
              },
              "id": {
                "pattern": "^[a-fA-F0-9]{8}-[a-fA-F0-9]{4}-[a-fA-F0-9]{4}-[a-fA-F0-9]{4}-[a-fA-F0-9]{12}$",
                "term": {
                  "description": "A 128-bit identifier. Depending on the mechanism used to generate it, it is either guaranteed to be different from all other UUIDs/GUIDs generated until 3400 AD or extremely likely to be different. Its relatively small size lends itself well to sorting, ordering, and hashing of all sorts, storing in databases, simple allocation, and ease of programming in general.\n",
                  "termDef": {
                    "cde_id": "C54100",
                    "cde_version": null,
                    "source": "NCIt",
                    "term": "Universally Unique Identifier",
                    "term_url": "https://ncit.nci.nih.gov/ncitbrowser/ConceptReport.jsp?dictionary=NCI_Thesaurus&version=16.02d&ns=NCI_Thesaurus&code=C54100"
                  }
                },
                "type": "string"
              }
            },
            "anyOf": [
              {
                "required": [
                  "submitter_id"
                ]
              },
              {
                "required": [
                  "id"
                ]
              }
            ]
          },
          "minItems": 1
        }
      ]
    }
  }
}
